{
  "$schema": "http://json-schema.org/draft-04/schema#",
  "description": "Retrieve a Self Assessment Tax Calculation",
  "type": "object",
  "properties": {
    "metadata": {
      "$ref": "retrieve/metadata.json"
    },
    "inputs": {
      "$ref": "retrieve/inputs.json"
    },
    "calculation": {
      "$ref": "retrieve/calculation.json"
    },
    "messages": {
      "$ref": "retrieve/messages.json"
    }
  },
  "required": [
    "metadata",
    "inputs"
  ],
  "additionalProperties": "false"
}